{
  "schema_version": 1,
  "provider": {
    "id": "supabase",
    "server_name": "kis-mcp-supabase"
  },
  "source": {
    "registry_url": "https://github.com/mcp/com.supabase/mcp",
    "repository": "https://github.com/supabase/mcp",
    "revision": "5cda0672702c65fe672280ee4cf306593e643fb6"
  },
  "upstream": {
    "transport": "streamable-http",
    "base_url": "https://mcp.supabase.com/mcp",
    "project_ref_env": "SUPABASE_PROJECT_REF",
    "access_token_env": "SUPABASE_ACCESS_TOKEN",
    "read_only": false,
    "features": [],
    "verify_tls": true
  },
  "downstream": {
    "transport": "stdio"
  }
}
